Question,Answer
How did communist propaganda address accusations of North Vietnam violating the Geneva Accord?,"To counter the accusation that North Vietnam was violating the Geneva Accord, the independence of the Việt Cộng was stressed in communist propaganda."
What organization did North Vietnam establish in December 1960 to support the Viet Cong in South Vietnam?,"North Vietnam created the National Liberation Front of South Vietnam in December 1960 as a ""united front"", or political branch of the Viet Cong, intended to encourage the participation of non-Communists."
What action did Hồ Chí Minh take at the end of 1959 regarding the next party leader in North Vietnam?,"At the end of 1959, aware that the national election would never be held and that Diem intended to purge opposing forces (mostly ex-Việt Minh) from South Vietnamese society, Hồ Chí Minh informally chose Lê Duẩn to become the next party leader."
How was Hồ Chí Minh's choice of Lê Duẩn as the next party leader interpreted by Western analysts?,"This was interpreted by Western analysts as a loss of influence for Hồ, who was said to have preferred the more moderate Võ Nguyên Giáp for the position."
"What concern did Hồ Chí Minh begin to have in 1959, leading him to write down his will?","From 1959 onward, the elderly Hồ became increasingly worried about the prospect of his death, and that year he wrote down his will."
"Who officially became the party leader in 1960, leaving Hồ Chí Minh in a secondary role?","Lê Duẩn was officially named party leader in 1960, leaving Hồ to function in a secondary role as head of state and member of the Politburo."
"Despite being in a secondary role, how did Hồ Chí Minh maintain influence in the government?",He nevertheless maintained considerable influence in the government.
Who were some key figures that often shared dinner with Hồ Chí Minh in the early 1960s?,"Lê Duẩn, Tố Hữu, Trường Chinh and Phạm Văn Đồng often shared dinner with Hồ, and all of them remained key figures throughout and after the war."
"What were the two main factions within the North Vietnamese Politburo in the early 1960s, and what were their respective focuses?","In the early 1960s, the North Vietnamese Politburo was divided into the ""North First"" faction which favored focusing on the economic development of North Vietnam, and the ""South First"" faction, which favored a guerrilla war in South Vietnam to reunite Vietnam shortly."
What significant military action occurred between 1961 and 1963 involving Communist soldiers?,"Between 1961 and 1963, 40,000 Communist soldiers infiltrated South Vietnam from the North."
What purported correspondence occurred between Hồ Chí Minh and South Vietnamese President Diem in 1963?,"In 1963, Hồ purportedly corresponded with South Vietnamese President Diem in hopes of achieving a negotiated peace."
What diplomatic initiative was launched in 1963 to achieve a federation of the two Vietnams?,"During the so-called ""Maneli Affair"" of 1963, a French diplomatic initiative was launched to achieve a federation of the two Vietnams, which would be neutral in the Cold War."
Who were the four principal diplomats involved in the 'Maneli affair'?,"The four principal diplomats involved in the ""Maneli affair"" were Ramchundur Goburdhun, the Indian Chief Commissioner of the ICC; Mieczysław Maneli, the Polish Commissioner to the ICC; Roger Lalouette, the French ambassador to South Vietnam; and Giovanni d'Orlandi, the Italian ambassador to South Vietnam."
"What was Hồ Chí Minh's attitude towards the American and South Vietnamese leadership, as reported by Mieczysław Maneli?","Maneli reported that Hồ was very interested in the signs of a split between President Diem and President Kennedy and that his attitude was: ""Our real enemies are the Americans."
What aspect of the Ho Chi Minh Trail did Hồ Chí Minh and Maneli discuss during their meeting?,"Get rid of them, and we can cope with Diem and Nhu afterward""."
What did Hồ Chí Minh say about President Diem during a meeting with Ramchundur Goburdhun in Hanoi?,"Hồ and Maneli also discussed the Ho Chi Minh Trail, which passed through officially neutral Cambodia and Laos, saying ""Indochina is just one single entity""."
What was North Vietnamese Premier Phạm Văn Đồng's response to the peace plan discussed by Maneli?,"At a meeting in Hanoi held in French, Hồ told Goburdhun that Diem was ""in his way a patriot"", noting that Diem had opposed French rule over Vietnam, and ended the meeting saying that the next time Goburdhun met Diem ""shake hands with him for me""."
"Who did Mieczysław Maneli meet with on September 2, 1963, to discuss the French peace plan?","The North Vietnamese Premier Phạm Văn Đồng, speaking on behalf of Hồ, told Maneli he was interested in the peace plan, saying that just as long as the American advisers left South Vietnam ""we can agree with any Vietnamese""."
What remains unclear about the Ngo brothers' response to the French peace plan?,"On 2 September 1963, Maneli met with Ngô Đình Nhu, the younger brother and right-hand man to Diem to discuss the French peace plan."
What action by Ngô Đình Nhu following his meeting with Maneli suggested a potential ulterior motive for considering the peace plan?,It remains unclear if the Ngo brothers were serious about the French peace plan or were merely using the possibility of accepting it to blackmail the United States into supporting them at a time when the Buddhist crisis had seriously strained relations between Saigon and Washington.
How did the leak of Ngô Đình Nhu's meeting with Maneli impact the Kennedy administration's strategy towards the Ngo brothers?,"Supporting the latter theory is the fact that Nhu promptly leaked his meeting with Maneli to the American columnist Joseph Alsop, who publicized it in a column entitled ""Very Ugly Stuff""."
What was the Kennedy administration's response to the possibility of the Ngo brothers accepting the peace plan?,The possibility that the Ngo brothers might accept the peace plan contributed to the Kennedy administration's plan to support a coup against them.
"What significant event occurred on November 1, 1963, in South Vietnam?","On 1 November 1963, a coup overthrew Diem, who was killed the next day together with his brother."
What policy did Diem follow that aimed to prevent a coup against him?,"Diem had followed a policy of ""deconstructing the state"" by creating several overlapping agencies and departments that were encouraged to feud with one another to disorganize the South Vietnamese state to such an extent that he hoped that it would make a coup against him impossible."
What was the immediate consequence of Diem's overthrow and death for the South Vietnamese state?,"When Diem was overthrown and killed, without any kind of arbiter between the rival arms of the South Vietnamese state, regime authority in South Vietnam promptly disintegrated."
What assessment did American Defense Secretary Robert McNamara provide after visiting South Vietnam in December 1963?,"The American Defense Secretary Robert McNamara reported after visiting South Vietnam in December 1963 that ""there is no organized government worthy of the name"" in Saigon."
What decision did the Politburo of North Vietnam make regarding the overthrow of the regime in Saigon at a meeting in December 1963?,"At a meeting of the plenum of the Politburo in December 1963, Lê Duẩn's ""South first"" faction triumphed, with the Politburo passing a resolution calling for North Vietnam to complete the overthrow of the regime in Saigon as soon as possible; while the members of the ""North first"" faction were dismissed."
How did the situation in South Vietnam impact Hồ Chí Minh's interest in the French peace plan?,"As the South descended into chaos, whatever interest Hồ might have had in the French peace plan faded, as it became clear the Viet Cong could overthrow the government in Saigon."
What did a CIA report from 1964 state about the factionalism in South Vietnam?,"A CIA report from 1964 stated that factionalism in South Vietnam had reached ""almost the point of anarchy"" as various South Vietnamese leaders fought one another, making any sort of effort against the Viet Cong impossible, which was rapidly taking over much of the South Vietnamese countryside."
What realization did President Lyndon Johnson come to as South Vietnam descended into chaos and the Viet Cong gained ground?,"As South Vietnam collapsed into factionalism and in-fighting while the Viet Cong continued to win the war, it became increasingly apparent to President Lyndon Johnson that only American military intervention could save South Vietnam."
How did President Lyndon Johnson attempt to communicate his intentions to Hanoi in June 1964?,"Though Johnson did not wish to commit American forces until he had won the 1964 election, he decided to make his intentions clear to Hanoi."
What was the purpose of the 'Seaborn Mission' that began in June 1964?,"In June 1964, the ""Seaborn Mission"" began as J. Blair Seaborn, the Canadian commissioner to the ICC, arrived in Hanoi with a message from Johnson offering billions of American economic aid and diplomatic recognition in exchange for which North Vietnam would cease trying to overthrow the government of South Vietnam."
"What potential action did President Johnson consider against North Vietnam, as warned by Seaborn?","Seaborn also warned that North Vietnam would suffer the ""greatest devastation"" from American bombing, saying that Johnson was seriously considering a strategic bombing campaign against North Vietnam."
What was the outcome of the backchannel of the 'Seaborn Mission' regarding Seaborn's interaction with Hồ Chí Minh?,"Little came of the backchannel of the ""Seaborn Mission"" as the North Vietnamese distrusted Seaborn, who pointedly was never allowed to meet Hồ."
Where were People's Army of Vietnam combat troops sent in late 1964?,"In late 1964, the People's Army of Vietnam combat troops were sent southwest into officially neutral Laos and Cambodia."
"When did American combat troops begin arriving in South Vietnam, and for what initial purpose?","By March 1965, American combat troops began arriving in South Vietnam, first to protect the airbases around Chu Lai and Da Nang, later to take on most of the fight as "" ore and more American troops were put in to replace Saigon troops who could not or would not, get involved in the fighting""."
What significant military operation began with widespread aerial and artillery bombardment by the United States in North Vietnam?,"As fighting escalated, widespread aerial and artillery bombardment all over North Vietnam by the United States Air Force and Navy began with Operation Rolling Thunder."
When did Hồ Chí Minh make a secret visit to Beijing to meet Mao Zedong?,"On 8–9 April 1965, Hồ made a secret visit to Beijing to meet Mao Zedong."
What agreement was reached during Hồ Chí Minh's visit to Beijing regarding Chinese combat troops in North Vietnam?,"It was agreed that no Chinese combat troops would enter North Vietnam unless the United States invaded North Vietnam, but that China would send support troops to North Vietnam to help maintain the infrastructure damaged by American bombing."
How was the suggestion of allowing Chinese troops into North Vietnam received by the North Vietnamese Politburo?,"There was deep distrust and fear of China within the North Vietnamese Politburo and the suggestion that Chinese troops, even support troops, be allowed into North Vietnam, caused outrage in the Politburo."
What did Hồ Chí Minh have to do to obtain the Politburo's approval for allowing Chinese support troops into North Vietnam?,Hồ had to use all his moral authority to obtain Politburo's approval.
"According to Chen Jian, what significant action did Lê Duẩn permit regarding Chinese volunteers in North Vietnam during the mid-to-late 1960s?","According to Chen Jian, during the mid-to-late 1960s, Lê Duẩn permitted 320,000 Chinese volunteers into North Vietnam to help build infrastructure for the country, thereby freeing a similar number of PAVN personnel to go south."
What sources confirm the number of Chinese troops stationed in North Vietnam?,"There are no sources from Vietnam, the United States, or the Soviet Union that confirm the number of Chinese troops stationed in North Vietnam."
How many Chinese soldiers did the Chinese government admit to sending to Vietnam during the 1960s?,"However, the Chinese government later admitted to sending 320,000 Chinese soldiers to Vietnam during the 1960s and spent over $20 billion to support Hanoi's regular North Vietnamese Army and Việt Cộng guerrilla units."
How was the entire population of North Vietnam mobilized for the war effort?,"To counter the American bombing, the entire population of North Vietnam was mobilized for the war effort, with vast teams of women being used to repair the damage done by the bombers, often at a speed that astonished the Americans."
"What was the principal obstacle to opening peace talks, according to Hồ?","The bombing of North Vietnam proved to be the principal obstacle to opening peace talks, as Hồ repeatedly stated that no peace talks would be possible unless the United States unconditionally ceased bombing North Vietnam."
Why was Hồ extremely sensitive about threats to his nation's independence and sovereignty?,"Like many of the other leaders of the newly independent states of Asia and Africa, Hồ was extremely sensitive about threats, whether perceived or real, to his nation's independence and sovereignty."
How did Hồ regard the American bombing of North Vietnam?,"Hồ regarded the American bombing as a violation of North Vietnam's sovereignty, and he felt that to negotiate with the Americans reserving the right to bomb North Vietnam should he not behave as they wanted him to do, would diminish North Vietnam's independence."
Who arrived in Hanoi in March 1966 with an offer to begin peace talks?,"In March 1966, a Canadian diplomat, Chester Ronning, arrived in Hanoi with an offer to use his ""good offices"" to begin peace talks."
Why did the Ronning mission fail?,"However, the Ronning mission foundered upon the bombing issue, as the North Vietnamese demanded an unconditional halt to the bombing, an undertaking that Johnson refused to give."
Who was able to see Henry Cabot Lodge Jr. with an offer from Hồ?,"In June 1966, Janusz Lewandowski, the Polish Commissioner to the ICC, was able via d'Orlandi to see Henry Cabot Lodge Jr, the American ambassador to South Vietnam, with an offer from Hồ."
What were some elements of Hồ's offer for a 'political compromise' as transmitted by Janusz Lewandowski?,"Hồ's offer for a ""political compromise"" as transmitted by Lewandowski included allowing South Vietnam to maintain its alliance with the U.S., instead of becoming neutral; having the Viet Cong ""take part"" in negotiations for a coalition government, instead of being allowed to automatically enter a coalition government; and allowing a ""reasonable calendar"" for the withdrawal of American troops instead of an immediate withdrawal."
"What was Operation Marigold, and what was its outcome?","Operation Marigold, as the Lewandowski channel came to be codenamed, almost led to American-North Vietnamese talks in Warsaw in December 1966; but collapsed over the bombing issue."
"Who presented a plan that became the genesis of the Tet Offensive, and when did this occur?","In January 1967, General Nguyễn Chí Thanh, the commander of communist forces in South Vietnam, returned to Hanoi, to present a plan that became the genesis of the Tet Offensive a year later."
"What was General Nguyễn Chí Thanh's concern, and what action did he urge to preempt it?","Thanh expressed much concern about the Americans invading Laos to cut the Ho Chi Minh Trail, and to preempt this possibility, urged an all-out offensive to win the war with a sudden blow."
"Who opposed General Nguyễn Chí Thanh's plans, and what alternative strategy did they prefer?","Lê' Duẩn supported Thanh's plans, which were stoutly opposed by the Defense Minister, General Võ Nguyên Giáp, who preferred to continue with guerrilla war, arguing that the superior American firepower would ensure the failure of Thanh's proposed offensive."
What was the outcome of the debate within the Politburo regarding General Nguyễn Chí Thanh's proposed offensive?,"With the Politburo divided, it was agreed to study and debate the issue more."
When did Hồ Chí Minh and most of the Politburo of the Communist Party conclude that the war had fallen into a stalemate?,"In July 1967, Hồ Chí Minh and most of the Politburo of the Communist Party met in a high-profile conference where they concluded the war had fallen into a stalemate."
What effect did the American military presence have on the resources of the PAVN?,The American military presence forced the PAVN to expend the majority of their resources on maintaining the Hồ Chí Minh trail rather than reinforcing their comrades' ranks in the South.
Why did Hồ Chí Minh seem to agree to Thanh's offensive?,"Hồ seems to have agreed to Thanh's offensive because he wanted to see Vietnam reunified within his lifetime, and the increasingly ailing Hồ was painfully aware that he did not have much time left."
"What permission did Hồ Chí Minh grant, and what was planned as a result?","With Hồ's permission, the Việt Cộng planned a massive offensive that would commence on 31 January 1968, to take much of the South by force and deal a heavy blow to the American military."
"What was the outcome of the offensive launched by the Việt Cộng on January 31, 1968?",The offensive was executed at great cost and with heavy casualties on Việt Cộng's political branches and armed forces.
How did the scope of the action during the Tet Offensive impact the world's perception of the war?,"The scope of the action shocked the world, which until then had been assured that the Communists were ""on the ropes""."
Why was the optimistic spin sustained by the American military command no longer credible?,The optimistic spin that the American military command had sustained for years was no longer credible.
What was the outcome of halting the bombing of North Vietnam and the Hồ Chí Minh trail?,"The bombing of North Vietnam and the Hồ Chí Minh trail was halted, and American and Vietnamese negotiators held discussions on how the war might be ended."
What strategy did Hồ Chí Minh and his government employ regarding conventional warfare and facing the United States Army?,"From then on, Hồ Chí Minh and his government's strategy, based on the idea of not using conventional warfare and facing the might of the United States Army, which would wear them down eventually while merely prolonging the conflict, would lead to the eventual acceptance of Hanoi's terms, materialized."
"What health issue did Hồ Chí Minh suffer in early 1969, and how did it affect him?","In early 1969, Hồ suffered a heart attack and was in increasingly bad health for the rest of the year."
Who relayed a letter from President Richard Nixon to Hồ Chí Minh in July 1969?,"In July 1969, Jean Sainteny, a former French official in Vietnam who knew Hồ secretly relayed a letter written to him from President Richard Nixon."
"What did Nixon's letter propose, and what consequences did it warn of if North Vietnam made no concessions?","Nixon's letter proposed working together to end this ""tragic war"", but also warned that if North Vietnam made no concessions at the peace talks in Paris by 1 November, Nixon would resort to ""measures of great consequence and force""."
How did Hồ Chí Minh respond to Nixon's letter?,"Hồ's reply letter, which Nixon received on 30 August 1969, welcomed peace talks with the U.S. to look for a way to end the war but made no concessions, as Nixon's threats made no impression on him."
"In addition to being a politician, what other roles did Hồ Chí Minh have?","In addition to being a politician, Hồ Chí Minh was also a writer, journalist, poet and polyglot."
What was Hồ Chí Minh's father's occupation and educational background?,His father was a scholar and teacher who received a high degree in the Nguyễn dynasty Imperial examination.
What language was Hồ Chí Minh taught to master at a young age?,Hồ was taught to master Classical Chinese at a young age.
"What type of poetry did he often write before the August Revolution, and in what writing system?","Before the August Revolution, he often wrote poetry in Chữ Hán (the Vietnamese name for the Chinese writing system)."
Which poetry chronicle written by Hồ Chí Minh is considered Vietnam National Treasure No. 10?,"One of those is Poems from the Prison Diary, written when he was imprisoned by the police of the Republic of China."
Which poetry chronicle written by Hồ Chí Minh is considered Vietnam National Treasure No. 10?,This poetry chronicle is Vietnam National Treasure No.
How widely has Poems from the Prison Diary been translated?,10 and was translated into many languages.
In what context is Poems from the Prison Diary used in Vietnamese high schools?,It is used in Vietnamese high schools.
What writing system did the new government exclusively promote after Vietnam gained independence from France?,"After Vietnam gained independence from France, the new government exclusively promoted Chữ Quốc Ngữ (Vietnamese writing system in Latin characters) to eliminate illiteracy."
Why did Hồ Chí Minh start creating more poems in the modern Vietnamese language?,Hồ started to create more poems in the modern Vietnamese language for dissemination to a wider range of readers.
How did Hồ Chí Minh encourage his people in the Tết edition of Nhân Dân newspaper?,"From when he became president until the appearance of serious health problems, a short poem of his was regularly published in the Tết (Lunar new year) edition of Nhân Dân newspaper to encourage his people in working, studying or fighting Americans in the new year."
"What languages could Hồ Chí Minh fluently speak, read, and write professionally?","Because he was in exile for nearly 30 years, Hồ could speak fluently as well as read and write professionally in different languages such as French, Russian, English, Cantonese and Mandarin, as well as his mother tongue Vietnamese."
What additional language was Hồ Chí Minh reported to speak?,"In addition, he was reported to speak conversational Esperanto."
"During the 1920s, what was Hồ Chí Minh's role in relation to newspapers, and what was their purpose?","In the 1920s, he was bureau chief/editor of many newspapers which he established to criticize French Colonial Government of Indochina and serving communist propaganda purposes."
Can you provide examples of newspapers that Hồ Chí Minh established during the 1920s?,Examples are Le Paria (The Pariah) first published in Paris 1922 or Thanh Nien (Youth) first published on 21 June 1925 (21 June was named by The Socialist Republic of Vietnam Government as Vietnam Revolutionary Journalism Day).
How did Hồ Chí Minh communicate with communist leaders during state visits to the Soviet Union and China?,"In many state official visits to the Soviet Union and China, he often talked directly to their communist leaders without interpreters, especially about top-secret information."
In what language did Hồ Chí Minh typically converse with Western journalists during interviews?,"While being interviewed by Western journalists, he used French."
What distinguished feature did Hồ Chí Minh's Vietnamese language have?,"His Vietnamese had a strong accent from his birthplace in the central province of Nghệ An, but could be widely understood throughout the country."
Where did Hồ Chí Minh hold formal receptions for foreign heads of state and ambassadors as president?,"As president, he held formal receptions for foreign heads of state and ambassadors at the Presidential Palace, but he did not live there."
What did Hồ Chí Minh order to be built at the back of the Presidential Palace?,"He ordered the building of a stilt house at the back of the palace, which is today known as the Presidential Palace Historical Site."
"According to his secretary Vũ Kỳ, what were some of Hồ Chí Minh's hobbies?","His hobbies (according to his secretary Vũ Kỳ) included reading, gardening, feeding fish (many of which are still living), and visiting schools and children's homes."
"Where did Hồ Chí Minh spend his final years, and what was one of his demands during this time?","Hồ Chí Minh remained in Hanoi during his final years, demanding the unconditional withdrawal of all non-Vietnamese troops in South Vietnam."
"When did Hồ Chí Minh's health begin to deteriorate, and what health problems did he face?","By 1969, with negotiations still dragging on, his health began to deteriorate from multiple health problems, including diabetes which prevented him from participating in further active politics."
What was Hồ Chí Minh's stance on the continuation of fighting in the South?,"However, he insisted that his forces in the South continue fighting until all of Vietnam was reunited regardless of the length of time that it might take, believing that time was on his side."
"What is the status of Hồ Chí Minh's marriage, and why is it shrouded in secrecy?",Hồ Chí Minh's marriage has long been swathed in secrecy and mystery.
"Who is believed to have been Hồ Chí Minh's spouse, and when did they marry?","He is believed by several scholars of Vietnamese history, to have married Zeng Xueming in October 1926, although only being able to live with her for less than a year."
