Question,Answer
Under what name did Hồ Chí Minh operate during his time in China?,He was using the name Hồ Quang during this period.
How did Hồ Chí Minh and his lieutenants view France's defeat by Germany in 1940?,"When France was defeated by Germany in 1940, Hồ and his lieutenants, Võ Nguyên Giáp and Phạm Văn Đồng, saw this as an opportunity to advance their own cause."
When did Hồ Chí Minh return to Vietnam to lead the Việt Minh independence movement?,"In 1941, Hồ Chí Minh returned to Vietnam to lead the Việt Minh independence movement."
What opportunity did the Japanese occupation of Indochina in 1941 create for patriotic Vietnamese?,"The Japanese occupation of Indochina that year, the first step toward an invasion of the rest of Southeast Asia, created an opportunity for patriotic Vietnamese."
What was the role of the so-called 'men in black' within the Việt Minh?,"The so-called ""men in black"" were a 10,000-member guerrilla force that operated with the Việt Minh."
"What military actions did Hồ Chí Minh oversee during World War II, and who clandestinely supported the Việt Minh?","He oversaw many successful military actions against the Vichy France and the Japanese occupation of Vietnam during World War II, supported closely yet clandestinely by the United States Office of Strategic Services and later against the French bid to reoccupy the country (1946–1954)."
"How did Hồ Chí Minh end up being jailed in China in 1943, and who rescued him?",He was jailed in China by Chiang Kai-shek's local authorities before being rescued by Chinese Communists.
What did Hồ Chí Minh do after his release from jail in China in 1943?,"Following his release in 1943, he returned to Vietnam."
"When did Hồ Chí Minh begin regularly using his Vietnamese name, and what does it signify?","It was during this time that he began regularly using the name Hồ Chí Minh, a Vietnamese name combining a common Vietnamese surname (Hồ, 胡) with a given name meaning ""Bright spirit"" or ""Clear will"" (from Sino-Vietnamese 志 明: Chí meaning ""will"" or ""spirit"" and Minh meaning ""bright"")."
"To whom did Hồ Chí Minh's new name pay tribute, and why?","–249 His new name was a tribute to General Hou Zhiming (侯志明), Chief Commissar of the 4th Military Region of the National Revolutionary Army, who helped release him from a KMT prison in 1943."
"In April 1945, who did Hồ Chí Minh meet with, and what offer did he make to them?","In April 1945, he met with the OSS agent Archimedes Patti and offered to provide intelligence, asking only for ""a line of communication"" between his Viet Minh and the Allies."
"How did the OSS respond to Hồ Chí Minh's offer in April 1945, and what assistance did they provide?",The OSS agreed to this and later sent a military team of OSS members to train his men and Hồ Chí Minh himself was treated for malaria and dysentery by an OSS doctor.
"What position did Hồ Chí Minh assume following the August Revolution, and what significant proclamation did he issue?","Following the August Revolution organized by the Việt Minh, Hồ Chí Minh became Chairman of the Provisional Government (Premier of the Democratic Republic of Vietnam) and issued a Proclamation of Independence of the Democratic Republic of Vietnam."
"Despite convincing Emperor Bảo Đại to abdicate, why was Hồ Chí Minh's government not recognized by any country?","Although he convinced Emperor Bảo Đại to abdicate, his government was not recognized by any country."
"To whom did Hồ Chí Minh repeatedly appeal for support for Vietnamese independence, and what was the response?","He repeatedly petitioned President Harry S. Truman for support for Vietnamese independence, citing the Atlantic Charter, but Truman never responded."
"In 1946, how did Hồ Chí Minh become acquainted with future Israeli Prime Minister David Ben-Gurion?","In 1946, future Israeli Prime Minister David Ben-Gurion and Hồ Chí Minh became acquainted when they stayed at the same hotel in Paris."
"What offer did Hồ Chí Minh extend to David Ben-Gurion in 1946, and how did Ben-Gurion respond?","He offered Ben-Gurion a Jewish home-in-exile in Vietnam, which Ben-Gurion declined."
"In 1946, what actions were taken by Hồ Chí Minh's subordinates when he traveled outside the country?","In 1946, when he traveled outside of the country, his subordinates imprisoned 2,500 non-Communist nationalists and forced 6,000 others to flee."
What significant event occurred in July 1946 regarding political opponents of the Viet Minh government?,"Hundreds of political opponents were jailed or exiled in July 1946, notably, members of the Nationalist Party of Vietnam and the Dai Viet National Party after a failed attempt to raise a coup against the Viet Minh government."
"Following the failed coup attempt in July 1946, what measures were taken by Hồ Chí Minh's government to minimize opposition?",All rival political parties were hereafter banned and local governments were purged to minimize opposition later on.
"Despite the ban on rival political parties, what notable composition did the Democratic Republic of Vietnam's first Congress have?","However, it was noted that the Democratic Republic of Vietnam's first Congress had over two-thirds of its members come from non-Việt Minh political factions, some without an election."
Who was named vice president of the Democratic Republic of Vietnam during this period?,Nationalist Party of Vietnam leader Nguyễn Hải Thần was named vice president.
What proportion of ministerial positions did non-Việt Minh political factions hold in the government of the Democratic Republic of Vietnam?,They also held four out of ten ministerial positions (Government of the Union of Resistance of the Democratic Republic of Vietnam ).
"What event led to Hồ Chí Minh reading the Declaration of Independence of Vietnam on September 2, 1945?","Following Emperor Bảo Đại's abdication in August, Hồ Chí Minh read the Declaration of Independence of Vietnam on 2 September 1945 under the name of the Democratic Republic of Vietnam."
Why did General Sir Douglas Gracey declare martial law in Saigon?,"In Saigon, with violence between rival Vietnamese factions and French forces increasing, the British commander, General Sir Douglas Gracey, declared martial law."
"How did the Việt Minh leaders respond on September 24, 1945, to the increasing violence?","On 24 September, the Việt Minh leaders responded with a call for a general strike."
What significant event occurred in Hanoi in September 1945 involving the Chinese National Revolutionary Army?,"In the same month, a force of 200,000 Chinese National Revolutionary Army troops arrived in Hanoi to accept the surrender of the Japanese occupiers in northern Indochina."
What compromise did Hồ Chí Minh make with General Lu Han regarding the Communist Party and the government in Vietnam?,"Hồ Chí Minh made a compromise with their general, Lu Han, to dissolve the Communist Party and to hold an election that would yield a coalition government."
"Why did Chiang sign an agreement with France on March 6, 1946, recognizing Vietnam as an autonomous state?","When Chiang forced the French to give the French concessions in Shanghai back to China in exchange for withdrawing from northern Indochina, he had no choice but to sign an agreement with France on 6 March 1946 in which Vietnam would be recognized as an autonomous state in the Indochinese Federation and the French Union."
What led to the breakdown of the agreement between France and the Vietminh?,The agreement soon broke down.
"What was the purpose of the agreement signed on March 6, 1946, between France and Vietnam?","The purpose of the agreement, for both the French and Vietminh, was for Chiang's army to leave North Vietnam."
What happened in North Vietnam after the Chinese troops left?,Fighting broke out in the North soon after the Chinese left.
What challenge to the authenticity of a quote attributed to Hồ Chí Minh was raised by Historian Professor Liam Kelley?,"Historian Professor Liam Kelley of the University of Hawaii at Manoa on his Le Minh Khai's Asian History Blog challenged the authenticity of the alleged quote where Hồ Chí Minh said he ""would rather smell French shit for five years than eat Chinese shit for a thousand,"" noting that Stanley Karnow provided no source for the extended quote attributed to him in his 1983 Vietnam: A History and that the original quote was most likely forged by the Frenchman Paul Mus in his 1952 book Vietnam: Sociologie d'une Guerre."
Why did Hồ Chí Minh believe there was no danger of Chinese troops staying in Vietnam?,Mus was a supporter of French colonialism in Vietnam and Hồ Chí Minh believed there was no danger of Chinese troops staying in Vietnam.
What was the attitude of the Vietnamese towards French colonialism and Chinese aid during the period after 1949?,"The Vietnamese at the time were busy spreading anti-French propaganda as evidence of French atrocities in Vietnam emerged, while Hồ Chí Minh showed no qualms about accepting Chinese aid after 1949."
How did the Việt Minh collaborate with French colonial forces in 1945–1946?,"The Việt Minh then collaborated with French colonial forces to massacre supporters of rival Vietnamese nationalist movements in 1945–1946, and of the Trotskyists."
"What challenges did Trotskyism present to the Communist Party in Vietnam, particularly in Saigon-Cochinchina?","Trotskyism in Vietnam did not rival the Party outside of the major cities, but particularly in the South, in Saigon-Cochinchina, they had been a challenge."
What were the primary demands of the Trotskyists in Vietnam?,"From the outset, they had called for armed resistance to a French restoration and an immediate transfer of industry to workers and land to peasants."
What was Hồ Chí Minh's response when asked about the fate of the Trotskyist leader Tạ Thu Thâu by Daniel Guérin?,"The French Socialist leader Daniel Guérin recalls that when in Paris in 1946 he asked Hồ Chí Minh about the fate of the Trotskyist leader Tạ Thu Thâu, Hồ Chí Minh had replied, ""with unfeigned emotion,"" that ""'Thâu was a great patriot and we mourn him', but then a moment later added in a steady voice 'All those who do not follow the line which I have laid down will be broken.'"""
What was the outcome regarding non-Communist parties as the Communists gained power in Vietnam?,"The Communists eventually suppressed all non-Communist parties, but they failed to secure a peace deal with France."
What realization did the Democratic Republic of Vietnam government come to in the final days of 1946?,"In the final days of 1946, after a year of diplomatic failure and many concessions in agreements, such as the Dalat and Fontainebleau conferences, the Democratic Republic of Vietnam government found that war was inevitable."
How did the bombardment of Haiphong by the French Navy impact perceptions of France's intentions in Vietnam?,"The bombardment of Haiphong by the French Navy only strengthened the belief that France had no intention of allowing an autonomous, independent state in Vietnam."
What was the reported casualty count of Vietnamese civilians in Haiphong as a result of the French Navy's bombardment?,"The attack reportedly killed more than 6,000 Vietnamese civilians in Haiphong."
"What event occurred after French forces marched into Hanoi, the capital city of the Democratic Republic of Vietnam?","French forces marched into Hanoi, now the capital city of the Democratic Republic of Vietnam."
"What significant declaration did Hồ Chí Minh make on December 19, 1946, following the Haiphong incident?","On 19 December 1946, after the Haiphong incident, Hồ Chí Minh declared war against the French Union, marking the beginning of the Indochina War."
How did the Vietnam National Army initially engage the French forces?,"The Vietnam National Army, mostly armed with machetes and muskets immediately attacked."
What tactics did the Vietnam National Army employ during their assault on the French positions?,"They assaulted the French positions, smoking them out with straw bundled with chili pepper, destroying armored vehicles with ""lunge mines"" (a hollow-charge warhead on the end of a pole, detonated by thrusting the charge against the side of a tank; typically a suicide weapon) and Molotov cocktails, holding off attackers by using roadblocks, landmines and gravel."
What was the outcome after two months of fighting between the Việt Minh forces and the French?,"After two months of fighting, the exhausted Việt Minh forces withdrew after systematically destroying any valuable infrastructure."
What mistaken report circulated regarding Hồ Chí Minh during Operation Léa led by Jean Étienne Valluy?,"Hồ was mistakenly reported to be captured by a group of French soldiers, led by Jean Étienne Valluy at Việt Bắc, during Operation Léa."
"Who was the individual mistakenly reported to be Hồ Chí Minh during Operation Léa, and what was his fate?",The person in question turned out to be a Việt Minh advisor who was killed trying to escape.
"According to journalist Bernard Fall, what decision did Hồ Chí Minh make after fighting the French for several years?","According to journalist Bernard Fall, Hồ decided to negotiate a truce after fighting the French for several years."
What was the condition of the meeting site when the French negotiators arrived?,"When the French negotiators arrived at the meeting site, they found a mud hut with a thatched roof."
What was found inside the mud hut where the negotiations were supposed to take place?,Inside they found a long table with chairs.
What indication did the presence of a silver ice bucket and champagne bottle in the negotiation room give about Hồ Chí Minh's expectations?,"In one corner of the room, a silver ice bucket contained ice and a bottle of good champagne, indicating that Hồ expected the negotiations to succeed."
"What demand did the French make regarding the return of Japanese military officers, and why?",One demand by the French was the return to French custody of several Japanese military officers (who had been helping the Vietnamese armed forces by training them in the use of weapons of Japanese origin) for them to stand trial for war crimes committed during World War II.
How did Hồ Chí Minh respond to the French demand regarding the Japanese officers?,"Hồ Chí Minh replied that the Japanese officers were allies and friends whom he could not betray, therefore he walked out to seven more years of war."
"What significant meeting occurred in Moscow in February 1950, and who participated in it?","In February 1950, after the Battle of Route Coloniale 4 successfully removed the French border blockade, he met with Joseph Stalin and Mao Zedong in Moscow after the Soviet Union recognized his government."
What agreement was reached regarding China's support for the Việt Minh during the meeting in Moscow?,They all agreed that China would be responsible for backing the Việt Minh.
"What plans did China have regarding the training of Viet Minh forces, as stated by Mao Zedong's emissary to Moscow?","Mao Zedong's emissary to Moscow stated in August that China planned to train 60,000–70,000 Viet Minh shortly."
How did the Battle of Route Coloniale 4 impact the Việt Minh's ability to receive external support?,The road to the outside world was open for Việt Minh forces to receive additional supplies which would allow them to escalate the fight against the French regime throughout Indochina.
What statement attributed to Hồ Chí Minh reflected his attitude towards the conflict with the French?,"At the outset of the conflict, Hồ reportedly told a French visitor: ""You can kill ten of my men for every one I kill of yours."
How did the First Indochina War come to an end in 1954?,"But even at those odds, you will lose and I will win""."
What was the outcome of the Battle of Dien Bien Phu in 1954?,"In 1954, the First Indochina War came to an end after the decisive Battle of Dien Bien Phu, where more than 10,000 French soldiers surrendered to the Viet Minh."
What was the outcome of the subsequent Geneva Accords peace process?,The subsequent Geneva Accords peace process partitioned North Vietnam at the 17th parallel.
"According to Arthur Dommen, how many civilians does he estimate were killed by the Việt Minh during the war?","Arthur Dommen estimates that the Việt Minh killed between 100,000 and 150,000 civilians during the war."
"According to Benjamin Valentino's estimates, how many civilian deaths does he attribute to the French during the war?","By comparison to Dommen's calculation, Benjamin Valentino estimates that the French were responsible for 60,000–250,000 civilian deaths."
"What did the 1954 Geneva Accords conclude between France and the Việt Minh, regarding the Việt Minh's forces and anti-Communist groups?","The 1954 Geneva Accords concluded between France and the Việt Minh, allowing the latter's forces to regroup in the North whilst anti-Communist groups settled in the South."
What happened to the Democratic Republic of Vietnam following the Geneva Accords?,"His Democratic Republic of Vietnam relocated to Hanoi and became the government of North Vietnam, a Communist-led one-party state."
What provision was made regarding the movement of people between the two regions of Vietnam after the Geneva Accords?,"Following the Geneva Accords, there was to be a 300-day period in which people could freely move between the two regions of Vietnam, later known as South Vietnam and North Vietnam."
"During the 300-day period after the Geneva Accords, what campaign did Diệm and CIA adviser Colonel Edward Lansdale stage?","During the 300 days, Diệm and CIA adviser Colonel Edward Lansdale staged a campaign to convince people to move to South Vietnam."
Who was the campaign particularly focused on during the 300-day period after the Geneva Accords?,"The campaign was particularly focused on Vietnam's Catholics, who were to provide Diệm's power base in his later years, with the use of the slogan ""God has gone south""."
"How many people migrated to the South during the 300-day period after the Geneva Accords, according to estimates?","Between 800,000 and 1,000,000 people migrated to the South, mostly Catholics."
What event occurred at the start of 1955 in relation to French Indochina?,"At the start of 1955, French Indochina was dissolved, leaving Diệm in temporary control of the South."
What was the stance of all parties at the Geneva Conference regarding reunification elections?,"All the parties at Geneva called for reunification elections, but they could not agree on the details."
What proposal did Việt Minh acting foreign minister Phạm Văn Đồng make regarding the supervision of elections?,"Recently appointed Việt Minh acting foreign minister Phạm Văn Đồng proposed elections under the supervision of ""local commissions""."
"What plan did the United States, along with Britain and the Associated States of Vietnam, Laos, and Cambodia, suggest for the supervision of elections?","The United States, with the support of Britain and the Associated States of Vietnam, Laos, and Cambodia, suggested United Nations supervision."
Why was the plan suggested by the United States rejected by Soviet representative Vyacheslav Molotov?,"This plan was rejected by Soviet representative Vyacheslav Molotov, who argued for a commission composed of an equal number of communist and non-communist members, which could determine ""important"" issues only by unanimous agreement."
What was the major point of contention regarding the date for the elections for reunification?,The negotiators were unable to agree on a date for the elections for reunification.
What was North Vietnam's proposal regarding the timeline for reunification elections?,North Vietnam argued that the elections should be held within six months of the ceasefire while the Western allies sought to have no deadline.
What timeline did Molotov propose for the reunification elections?,"Molotov proposed June 1955, then later softened this to any time in 1955 and finally July 1956."
What was the stance of the Diem government regarding reunification elections?,"The Diem government supported reunification elections, but only with effective international supervision, arguing that genuinely free elections were otherwise impossible in the totalitarian North."
When were the remaining outstanding issues at the Geneva Conference resolved?,"By the afternoon of 20 July 1954, the remaining outstanding issues were resolved as the parties agreed that the partition line should be at the 17th parallel and the elections for a reunified government should be held in July 1956, two years after the ceasefire."
Who signed the Agreement on the Cessation of Hostilities in Vietnam?,"The Agreement on the Cessation of Hostilities in Vietnam was only signed by the French and Việt Minh military commands, with no participation or consultation of the State of Vietnam."
Who chaired the International Control Commission (ICC) tasked with supervising the ceasefire?,"Based on a proposal by Chinese delegation head Zhou Enlai, an International Control Commission (ICC) chaired by India, with Canada and Poland as members, was placed in charge of supervising the ceasefire."
How did Poland's presence in the ICC affect the supervision of the treaty?,"Because issues were to be decided unanimously, Poland's presence in the ICC provided the Communists with effective veto power over supervision of the treaty."
What did the unsigned Final Declaration of the Geneva Conference call for?,"The unsigned Final Declaration of the Geneva Conference called for reunification elections, which the majority of delegates expected to be supervised by the ICC."
Why did the Việt Minh never accept ICC authority over reunification elections?,"The Việt Minh never accepted ICC authority over such elections, insisting that the ICC's ""competence was to be limited to the supervision and control of the implementation of the Agreement on the Cessation of Hostilities by both parties""."
Which countries refused to accept the Final Declaration of the Geneva Conference?,"Of the nine nations represented, only the United States and the State of Vietnam refused to accept the declaration."
What was the United States' position on achieving unity in Vietnam?,"Undersecretary of state Walter Bedell Smith delivered a ""unilateral declaration"" of the United States position, reiterating: ""We shall seek to achieve unity through free elections supervised by the United Nations to ensure that they are conducted fairly""."
What agrarian reforms were instituted by the North Vietnamese government between 1953 and 1956?,"Between 1953 and 1956, the North Vietnamese government instituted various agrarian reforms, including ""rent reduction"" and ""land reform"", which were accompanied with executions of ""reactionary and evil landlords."""
What was the estimated ratio of executions per village resident during the land reform campaign?,"During the land reform, testimonies by North Vietnamese witnesses suggested a ratio of one execution per 160 village residents, which if extrapolated would indicate a nationwide total of nearly 100,000 executions."
What was the widely accepted lower estimate of executions during the land reform campaign?,"Because the campaign was concentrated mainly in the Red River Delta area, a lower estimate of 50,000 executions was widely accepted by scholars at the time."
What do declassified documents from Vietnamese and Hungarian archives suggest about the actual number of executions?,"However, declassified documents from the Vietnamese and Hungarian archives indicate that the number of executions was much lower than reported at the time, although it was likely greater than 13,500."
What action did North Vietnam take in early 1956 regarding land reform?,"In early 1956, North Vietnam ended the land reform and initiated a ""correction of errors"" to rectify the mistakes and damage done."
What did Ho Chi Minh do in 1956 regarding the mistakes made in the land reform?,"That year, Ho Chi Minh apologised and acknowledged the serious errors the government had made in the land reform."
How many political prisoners were released by North Vietnam as part of the correction campaign by September 1957?,"As part of the campaign, as many as 23,748 political prisoners were released by North Vietnam by September 1957."
What was the outcome of the correction campaign by 1958?,"By 1958, the correction campaign had resulted in the return of land to many of those harmed by the land reform."
When was the idea of overthrowing the South Vietnamese government first presented at a Politburo meeting?,"As early as June 1956, the idea of overthrowing the South Vietnamese government was presented at a Politburo meeting."
What action did Hồ Chí Minh urge the Politburo to take in 1959 regarding aid to the Việt Cộng in South Vietnam?,"In 1959, Hồ Chí Minh began urging the Politburo to send aid to the Việt Cộng in South Vietnam; a ""people's war"" on the South was approved at a session in January 1959, and this decision was confirmed by the Politburo in March."
What event occurred in July 1959 involving North Vietnam's military action in Laos?,"North Vietnam invaded Laos in July 1959, aided by the Pathet Lao, and used 30,000 men to build a network of supply and reinforcement routes running through Laos and Cambodia that became known as the Hồ Chí Minh trail."
What strategic advantage did the Hồ Chí Minh trail provide to North Vietnam?,"It allowed the North to send manpower and material to the Việt Cộng with much less exposure to South Vietnamese forces, achieving a considerable advantage."
